dataset_id,dataset_name,provider,source_type,region_scope,original_url,download_url,local_path,classes_or_targets,features_summary,has_n,has_p,has_k,has_ph,has_temperature,has_rainfall,has_soil_moisture,is_tabular,target_label_clear,supervised_usable,compatible_with_zone_pipeline,selected_for_main_integration,integration_role,primary_risks,notes,row_count,column_count,columns,crop_classes_available
ref_active_zone,Current active zone dataset,Local processed project dataset,active_zone_dataset,Ethiopia,,,data/processed/zone_dataset_extended_id.csv,"Jelai, Jagung, Teff, Gandum","zone-level aggregates for pH, N, P, K, zinc, sulfur, temperature, rainfall, soil moisture, pressure",1,1,1,1,1,1,1,1,1,1,1,1,base_anchor_dataset,Small dataset; Ethiopian domain; pseudo-zones not geospatially validated.,Kept as the anchor dataset for the expanded Indonesian-label training set.,33,149,"zone_id, base_context_id, source_dataset, sample_count, context_sample_count, context_cluster_count, label_nunique, zone_label_dominance_ratio, sample_count_risk_flag, soil_color_mode, soil_color_nunique, soil_color_dominant_ratio, soil_color_missing_ratio, ph_mean, ph_std, ph_min, ph_max, ph_median, ph_count, ph_range, ph_cv, ph_missing_ratio, nitrogen_mean, nitrogen_std, nitrogen_min, nitrogen_max, nitrogen_median, nitrogen_count, nitrogen_range, nitrogen_cv, nitrogen_missing_ratio, phosphorus_mean, phosphorus_std, phosphorus_min, phosphorus_max, phosphorus_median, phosphorus_count, phosphorus_range, phosphorus_cv, phosphorus_missing_ratio, potassium_mean, potassium_std, potassium_min, potassium_max, potassium_median, potassium_count, potassium_range, potassium_cv, potassium_missing_ratio, zinc_mean, zinc_std, zinc_min, zinc_max, zinc_median, zinc_count, zinc_range, zinc_cv, zinc_missing_ratio, sulfur_mean, sulfur_std, sulfur_min, sulfur_max, sulfur_median, sulfur_count, sulfur_range, sulfur_cv, sulfur_missing_ratio, soil_moisture_surface_mean, soil_moisture_surface_std, soil_moisture_surface_min, soil_moisture_surface_max, soil_moisture_surface_median, soil_moisture_surface_count, soil_moisture_surface_range, soil_moisture_surface_cv, soil_moisture_surface_missing_ratio, wind_speed_10m_mean, wind_speed_10m_std, wind_speed_10m_min, wind_speed_10m_max, wind_speed_10m_median, wind_speed_10m_count, wind_speed_10m_range, wind_speed_10m_cv, wind_speed_10m_missing_ratio, specific_humidity_mean_mean, specific_humidity_mean_std, specific_humidity_mean_min, specific_humidity_mean_max, specific_humidity_mean_median, specific_humidity_mean_count, specific_humidity_mean_range, specific_humidity_mean_cv, specific_humidity_mean_missing_ratio, temperature_mean_mean, temperature_mean_std, temperature_mean_min, temperature_mean_max, temperature_mean_median, temperature_mean_count, temperature_mean_range, temperature_mean_cv, temperature_mean_missing_ratio, temperature_seasonal_range_mean, temperature_seasonal_range_std, temperature_seasonal_range_min, temperature_seasonal_range_max, temperature_seasonal_range_median, temperature_seasonal_range_count, temperature_seasonal_range_range, temperature_seasonal_range_cv, temperature_seasonal_range_missing_ratio, rainfall_mean_mean, rainfall_mean_std, rainfall_mean_min, rainfall_mean_max, rainfall_mean_median, rainfall_mean_count, rainfall_mean_range, rainfall_mean_cv, rainfall_mean_missing_ratio, rainfall_total_proxy_mean, rainfall_total_proxy_std, rainfall_total_proxy_min, rainfall_total_proxy_max, rainfall_total_proxy_median, rainfall_total_proxy_count, rainfall_total_proxy_range, rainfall_total_proxy_cv, rainfall_total_proxy_missing_ratio, cloud_amount_mean, cloud_amount_std, cloud_amount_min, cloud_amount_max, cloud_amount_median, cloud_amount_count, cloud_amount_range, cloud_amount_cv, cloud_amount_missing_ratio, surface_pressure_mean, surface_pressure_std, surface_pressure_min, surface_pressure_max, surface_pressure_median, surface_pressure_count, surface_pressure_range, surface_pressure_cv, surface_pressure_missing_ratio, zone_target",
cand_kaggle_crop_recommendation,Crop Recommendation dataset (Kaggle-origin mirror),Kaggle / GitHub mirror,kaggle_benchmark_tabular,Global/generalized benchmark,https://www.kaggle.com/datasets/irakozekelly/crop-recommendation-dataset,https://raw.githubusercontent.com/nileshiq/Crop-Recommendation/main/Crop_Recommendation.csv,datasets/csv/crop_recommendation_kaggle_mirror.csv,"Rice, Maize, Banana, Coconut, Coffee, Mango, Orange, Papaya, Watermelon, MungBean and others","N, P, K, temperature, humidity, pH, rainfall, crop label",1,1,1,1,1,1,0,1,1,1,1,1,selected_additional_source,Benchmark provenance rather than field-operational deployment data; no explicit spatial field zones.,Selected. Converted into pseudo-zones without using labels during zone formation; humidity was excluded from final unified schema due semantic mismatch with active specific_humidity feature.,2200,8,"Nitrogen, Phosphorus, Potassium, Temperature, Humidity, pH_Value, Rainfall, Crop","Rice, Maize, ChickPea, KidneyBeans, PigeonPeas, MothBeans, MungBean, Blackgram, Lentil, Pomegranate, Banana, Mango, Grapes, Watermelon, Muskmelon"
cand_mendeley_vynxnppr7j,Crop recommendation (integrated multi-source + CTGAN),Mendeley Data,mendeley_ctgan_augmented,India (Tamil Nadu),https://data.mendeley.com/datasets/vynxnppr7j/1,https://data.mendeley.com/public-files/datasets/vynxnppr7j/files/cdc23a7e-8306-48d0-be6d-b355aea63c92/file_downloaded,archive/legacy_pre_zone/datasets/csv/mendeley_vynxnppr7j_crop_recommendation.csv,"rice, maize, soyabean, groundnut, sugarcane, onion, chillies and many others","N, P, K, soil_pH, temperature, relative_humidity, soil, season, water_source, crop duration, water required, crop label",1,1,1,1,1,0,0,1,1,1,0,0,experimental_only,Record explicitly states CTGAN-based synthetic expansion; rainfall not present; direct merge would require aggressive imputation and stronger assumptions.,"Rejected for main merge, but important as evidence that Indonesian-relevant labels do exist in public augmented datasets.",57000,23,"CROPS, TYPE_OF_CROP, SOIL, SEASON, SOWN, HARVESTED, WATER_SOURCE, SOIL_PH, SOIL_PH_HIGH, CROPDURATION, CROPDURATION_MAX, TEMP, MAX_TEMP, WATERREQUIRED, WATERREQUIRED_MAX, RELATIVE_HUMIDITY, RELATIVE_HUMIDITY_MAX, N, N_MAX, P, P_MAX, K, K_MAX","rice, wheat, maize, sorghum, Pearl millet, ragi, panivaragu, samai, thinai, varagu, kudiraivali, blackgram, greengram, cowpea, bengalgram"
cand_zenodo_rice_fertility,Machine Learning Training Data (Rice),Zenodo,single_crop_fertility_classification,Not clearly specified,https://zenodo.org/records/15307297,https://zenodo.org/records/15307297/files/Machine%20Learning-Training%20Data%20%28Rice%29.csv?download=1,datasets/csv/rice_npk_fertility_zenodo.csv,Fertility class only,"Nitrogen, Phosphorus, Potassium, fertility target",1,1,1,0,0,0,0,1,0,0,0,0,rejected,"Target is fertility class, not crop recommendation.","Useful only as crop-specific fertility auxiliary data for rice, not for adding a Padi class to multiclass crop recommendation.",2000,4,"Nitrogen, Phosphorus, Potassium, Fertility","1, 2, 0, 3"
cand_github_sugarcane,Sugarcane yield prediction dataset,GitHub repository,yield_prediction_tabular,Brazil,https://github.com/raulpoppiel/sugarcane-yield-prediction,https://raw.githubusercontent.com/raulpoppiel/sugarcane-yield-prediction/main/01_input_data/sugarcane_data.csv,datasets/csv/sugarcane_data_github.csv,Yield target only,"weather, remote sensing, management, variety; no consistent NPK/pH schema",0,0,0,0,1,1,0,1,0,0,0,0,rejected,"Single-crop yield task, not multiclass crop recommendation; feature semantics differ strongly.",Not appropriate for class expansion even though it is agronomically rich.,402,293,"ID_SIG, VARIEDADE, TCH_ANT, Ordem, EST_Corte, 12_temperature_2m, 12_total_precipitation_sum, 12_surface_solar_radiation_downwards_sum, 01_temperature_2m, 01_total_precipitation_sum, 01_surface_solar_radiation_downwards_sum, 02_temperature_2m, 02_total_precipitation_sum, 02_surface_solar_radiation_downwards_sum, 03_temperature_2m, 03_total_precipitation_sum, 03_surface_solar_radiation_downwards_sum, 01_ALT, 01_ARMf, 01_ARMi, 01_Def, 01_Def_rel, 01_ETP, 01_ETR, 01_ETc, 01_Exc, 01_Kc, 01_NAC, 01_P_ETc, 02_ALT, 02_ARMf, 02_ARMi, 02_Def, 02_Def_rel, 02_ETP, 02_ETR, 02_ETc, 02_Exc, 02_Kc, 02_NAC, 02_P_ETc, 03_ALT, 03_ARMf, 03_ARMi, 03_Def, 03_Def_rel, 03_ETP, 03_ETR, 03_ETc, 03_Exc, 03_Kc, 03_NAC, 03_P_ETc, 04_ALT, 04_ARMf, 04_ARMi, 04_Def, 04_Def_rel, 04_ETP, 04_ETR, 04_ETc, 04_Exc, 04_Kc, 04_NAC, 04_P_ETc, 05_ALT, 05_ARMf, 05_ARMi, 05_Def, 05_Def_rel, 05_ETP, 05_ETR, 05_ETc, 05_Exc, 05_Kc, 05_NAC, 05_P_ETc, 06_ALT, 06_ARMf, 06_ARMi, 06_Def, 06_Def_rel, 06_ETP, 06_ETR, 06_ETc, 06_Exc, 06_Kc, 06_NAC, 06_P_ETc, 07_ALT, 07_ARMf, 07_ARMi, 07_Def, 07_Def_rel, 07_ETP, 07_ETR, 07_ETc, 07_Exc, 07_Kc, 07_NAC, 07_P_ETc, 08_ALT, 08_ARMf, 08_ARMi, 08_Def, 08_Def_rel, 08_ETP, 08_ETR, 08_ETc, 08_Exc, 08_Kc, 08_NAC, 08_P_ETc, 09_ALT, 09_ARMf, 09_ARMi, 09_Def, 09_Def_rel, 09_ETP, 09_ETR, 09_ETc, 09_Exc, 09_Kc, 09_NAC, 09_P_ETc, 10_ALT, 10_ARMf, 10_ARMi, 10_Def, 10_Def_rel, 10_ETP, 10_ETR, 10_ETc, 10_Exc, 10_Kc, 10_NAC, 10_P_ETc, 11_ALT, 11_ARMf, 11_ARMi, 11_Def, 11_Def_rel, 11_ETP, 11_ETR, 11_ETc, 11_Exc, 11_Kc, 11_NAC, 11_P_ETc, 12_ALT, 12_ARMf, 12_ARMi, 12_Def, 12_Def_rel, 12_ETP, 12_ETR, 12_ETc, 12_Exc, 12_Kc, 12_NAC, 12_P_ETc, 13_ALT, 13_ARMf, 13_ARMi, 13_Def, 13_Def_rel, 13_ETP, 13_ETR, 13_ETc, 13_Exc, 13_Kc, 13_NAC, 13_P_ETc, 14_ALT, 14_ARMf, 14_ARMi, 14_Def, 14_Def_rel, 14_ETP, 14_ETR, 14_ETc, 14_Exc, 14_Kc, 14_NAC, 14_P_ETc, 15_ALT, 15_ARMf, 15_ARMi, 15_Def, 15_Def_rel, 15_ETP, 15_ETR, 15_ETc, 15_Exc, 15_Kc, 15_NAC, 15_P_ETc, 12_NDVI, 12_EVI, 12_SAVI, 12_NDMI, 12_NDWI1, 12_NDWI2, 12_NDVIre1, 12_NDVIre2, 12_NDVIre3, 12_CIre1, 12_CIre2, 12_CIre3, 12_MSRre1, 12_MSRre2, 12_MSRre3, 12_SIWSI, 12_red, 12_nir, 12_swir1, 12_swir2, 12_rededge1, 12_rededge2, 12_rededge3, 12_nir8A, 01_NDVI, 01_EVI, 01_SAVI, 01_NDMI, 01_NDWI1, 01_NDWI2, 01_NDVIre1, 01_NDVIre2, 01_NDVIre3, 01_CIre1, 01_CIre2, 01_CIre3, 01_MSRre1, 01_MSRre2, 01_MSRre3, 01_SIWSI, 01_red, 01_nir, 01_swir1, 01_swir2, 01_rededge1, 01_rededge2, 01_rededge3, 01_nir8A, 02_NDVI, 02_EVI, 02_SAVI, 02_NDMI, 02_NDWI1, 02_NDWI2, 02_NDVIre1, 02_NDVIre2, 02_NDVIre3, 02_CIre1, 02_CIre2, 02_CIre3, 02_MSRre1, 02_MSRre2, 02_MSRre3, 02_SIWSI, 02_red, 02_nir, 02_swir1, 02_swir2, 02_rededge1, 02_rededge2, 02_rededge3, 02_nir8A, 03_NDVI, 03_EVI, 03_SAVI, 03_NDMI, 03_NDWI1, 03_NDWI2, 03_NDVIre1, 03_NDVIre2, 03_NDVIre3, 03_CIre1, 03_CIre2, 03_CIre3, 03_MSRre1, 03_MSRre2, 03_MSRre3, 03_SIWSI, 03_red, 03_nir, 03_swir1, 03_swir2, 03_rededge1, 03_rededge2, 03_rededge3, 03_nir8A",
cand_zenodo_17_crop_points,Global training samples bundle for 17 crops,Zenodo,geolocated_crop_points,Global,https://zenodo.org/records/17666722,https://zenodo.org/api/records/17666722/files/Training_samples_for_17_crops.zip/content,archive/legacy_pre_zone/datasets/csv/zenodo_17666722_training_samples_combined.csv,"Barley, Cassava, Maize, Paddy rice, Peanut, Soybean, Sugarcane, Wheat and others",species label + latitude/longitude only,0,0,0,0,0,0,0,1,1,0,0,0,future_spatial_join_candidate,Needs a full soil and climate spatial join pipeline before it can support supervised crop recommendation.,"Strong future expansion path for cassava, soybean, peanut, paddy rice, and sugarcane if global covariate extraction is implemented.",564158,5,"species, longitude, latitude, label, source_file","Wheat, Barley, Sugarbeet, Sunflower, Maize, Oilpalm, Rapeseed, Soybean, Potato, Rye, Sorghum, Cassava, Cotton, Millet, Peanut"
cand_agriculture_gist,Small agriculture gist dataset,GitHub Gist,toy_tabular,Unknown,https://gist.githubusercontent.com/ontipulikesava153/4dff8a942fb9983f526b6b042514cff0/raw/agriculture_dataset.csv,https://gist.githubusercontent.com/ontipulikesava153/4dff8a942fb9983f526b6b042514cff0/raw/agriculture_dataset.csv,datasets/csv/agriculture_dataset_gist.csv,Crop type,"farm area, irrigation, fertilizer used, soil type, season, yield",0,0,0,0,0,0,0,1,1,0,0,0,rejected,Very small and missing core nutrient features.,Rejected as a toy/example dataset.,50,10,"Farm_ID, Crop_Type, Farm_Area(acres), Irrigation_Type, Fertilizer_Used(tons), Pesticide_Used(kg), Yield(tons), Soil_Type, Season, Water_Usage(cubic meters)","Cotton, Barley, Tomato, Sugarcane, Soybean, Rice, Carrot, Wheat, Potato, Maize"
cand_crop_recommend_gist,Small crop recommendation gist,GitHub Gist,toy_tabular,Unknown,https://gist.githubusercontent.com/Deeraj7/32fa6d434a14e34776b3d32d6a94a49e/raw/crop_recommend.csv,https://gist.githubusercontent.com/Deeraj7/32fa6d434a14e34776b3d32d6a94a49e/raw/crop_recommend.csv,datasets/csv/crop_recommend_gist.csv,Crop Type,"soil type, temperature, humidity, pH, rainfall, crop type",0,0,0,1,1,1,0,1,1,0,0,0,rejected,Very small and missing NPK; likely demonstrative/toy.,Rejected because it would mostly add noise.,75,6,"Soil Type,  Temperature,  Humidity,  pH Level,  Rainfall,  Crop Type",
